"No.","Time","Source","Destination","Protocol","Length","Info"
"1","0.000000","192.168.1.19","142.250.68.10","TCP","54","56934  >  443 [FIN, ACK] Seq=1 Ack=1 Win=507 Len=0"
"2","0.038834","192.168.1.102","224.0.0.251","MDNS","124","Standard query 0x0000 PTR _companion-link._tcp.local, ""QU"" question PTR _rdlink._tcp.local, ""QU"" question PTR _sleep-proxy._udp.local, ""QU"" question"
"3","0.000000","fe80::10ba:ac04:f83d:2539","ff02::fb","MDNS","144","Standard query 0x0000 PTR _companion-link._tcp.local, ""QU"" question PTR _rdlink._tcp.local, ""QU"" question PTR _sleep-proxy._udp.local, ""QU"" question"
"4","0.000000","Routerboardc_64:1a:b5","Broadcast","ARP","60","Who has 209.33.202.179? Tell 209.33.202.177"
"5","0.000000","Routerboardc_64:1a:b5","Broadcast","ARP","60","Who has 209.33.217.76? Tell 209.33.217.65"
"6","0.000000","Routerboardc_64:1a:b5","Broadcast","ARP","60","Who has 209.33.202.186? Tell 209.33.202.177"
"7","0.000000","192.168.1.34","224.0.0.251","MDNS","91","Standard query 0x0000 PTR _raop._tcp.local, ""QM"" question PTR _airplay._tcp.local, ""QM"" question"
"8","0.000000","fe80::c7c:71ae:536b:9e17","ff02::fb","MDNS","111","Standard query 0x0000 PTR _raop._tcp.local, ""QM"" question PTR _airplay._tcp.local, ""QM"" question"
"9","0.016016","142.250.68.10","192.168.1.19","TCP","60","443  >  56934 [ACK] Seq=1 Ack=2 Win=283 Len=0"
"10","0.390772","209.33.202.177","255.255.255.255","MNDP","195","5678  >  5678 Len=153"
"11","0.000000","Routerboardc_64:1a:b5","Broadcast","ARP","60","Who has 209.33.202.189? Tell 209.33.202.177"
"12","0.000000","Routerboardc_64:1a:b5","Broadcast","ARP","60","Who has 209.33.202.180? Tell 209.33.202.177"
"13","0.027330","192.168.1.19","54.158.199.15","TLSv1.2","91","Application Data"
"14","0.083332","54.158.199.15","192.168.1.19","TLSv1.2","87","Application Data"
"15","0.038768","142.250.68.10","192.168.1.19","TLSv1.2","136","Application Data"
"16","0.003549","192.168.1.19","54.158.199.15","TCP","54","55486  >  443 [ACK] Seq=38 Ack=34 Win=509 Len=0"
"17","0.046802","192.168.1.19","142.250.68.10","TCP","54","56910  >  443 [ACK] Seq=1 Ack=83 Win=255 Len=0"
"18","0.210601","fe80::10ba:ac04:f83d:2539","ff02::fb","MDNS","144","Standard query 0x0000 PTR _companion-link._tcp.local, ""QM"" question PTR _rdlink._tcp.local, ""QM"" question PTR _sleep-proxy._udp.local, ""QM"" question"
"19","0.000000","Routerboardc_64:1a:b5","Broadcast","ARP","60","Who has 209.33.202.179? Tell 209.33.202.177"
"20","0.155050","192.168.1.19","8.8.8.8","DNS","86","Standard query 0x1244 A static-mobile.qustodio.com"
"21","0.028929","192.168.1.19","8.8.4.4","DNS","86","Standard query 0x1244 A static-mobile.qustodio.com"
"22","0.015283","8.8.8.8","192.168.1.19","DNS","321","Standard query response 0x1244 A static-mobile.qustodio.com CNAME static-mobile.qustodio.com.s3-website-us-east-1.amazonaws.com CNAME s3-website.us-east-1.amazonaws.com A 52.216.222.141 A 54.231.204.133 A 52.216.214.117 A 52.217.170.77 A 52.216.51.197 A 52.216.52.221 A 52.217.106.83 A 52.216.112.202"
"23","0.000635","192.168.1.19","52.216.222.141","TCP","66","56938  >  80 [SYN] Seq=0 Win=64240 Len=0 MSS=1460 WS=256 SACK_PERM"
"24","0.039049","8.8.4.4","192.168.1.19","DNS","321","Standard query response 0x1244 A static-mobile.qustodio.com CNAME static-mobile.qustodio.com.s3-website-us-east-1.amazonaws.com CNAME s3-website.us-east-1.amazonaws.com A 52.217.117.253 A 52.216.52.61 A 54.231.192.37 A 52.216.39.109 A 52.217.164.69 A 52.216.61.165 A 52.217.84.99 A 52.217.206.13"
"25","0.031787","52.216.222.141","192.168.1.19","TCP","66","80  >  56938 [SYN, ACK] Seq=0 Ack=1 Win=64240 Len=0 MSS=1432 WS=256 SACK_PERM"
"26","0.000145","192.168.1.19","52.216.222.141","TCP","54","56938  >  80 [ACK] Seq=1 Ack=1 Win=131584 Len=0"
"27","0.000123","192.168.1.19","52.216.222.141","HTTP","159","GET /zero.html HTTP/1.1 "
"28","0.079102","52.216.222.141","192.168.1.19","TCP","60","80  >  56938 [ACK] Seq=1 Ack=106 Win=64256 Len=0"
"29","0.018312","52.216.222.141","192.168.1.19","HTTP","410","HTTP/1.1 200 OK "
"30","0.000212","192.168.1.19","52.216.222.141","TCP","54","56938  >  80 [FIN, ACK] Seq=106 Ack=357 Win=131328 Len=0"
"31","0.035067","142.250.68.10","192.168.1.19","TLSv1.2","136","Application Data"
"32","0.006486","Routerboardc_64:1a:b5","Broadcast","ARP","60","Who has 209.33.217.76? Tell 209.33.217.65"
"33","0.000000","Routerboardc_64:1a:b5","Broadcast","ARP","60","Who has 209.33.202.186? Tell 209.33.202.177"
"34","0.034595","52.216.222.141","192.168.1.19","TCP","60","80  >  56938 [FIN, ACK] Seq=357 Ack=107 Win=64256 Len=0"
"35","0.000191","192.168.1.19","52.216.222.141","TCP","54","56938  >  80 [ACK] Seq=107 Ack=358 Win=131328 Len=0"
"36","0.005766","192.168.1.19","142.250.68.10","TCP","54","56913  >  443 [ACK] Seq=1 Ack=83 Win=255 Len=0"
"37","0.367784","Routerboardc_64:1a:b5","Broadcast","ARP","60","Who has 209.33.202.189? Tell 209.33.202.177"
"38","0.000000","Routerboardc_64:1a:b5","Broadcast","ARP","60","Who has 209.33.202.180? Tell 209.33.202.177"
"39","0.000000","Routerboardc_64:1a:b5","Broadcast","ARP","60","Who has 209.33.217.69? Tell 209.33.217.65"
"40","0.409859","Routerboardc_64:1a:b5","Broadcast","ARP","60","Who has 209.33.202.179? Tell 209.33.202.177"
"41","0.000000","Routerboardc_64:1a:b5","Broadcast","ARP","60","Who has 209.33.217.76? Tell 209.33.217.65"
"42","0.000000","Routerboardc_64:1a:b5","Broadcast","ARP","60","Who has 209.33.217.78? Tell 209.33.217.65"
"43","0.408788","Routerboardc_64:1a:b5","Broadcast","ARP","60","Who has 209.33.202.182? Tell 209.33.202.177"
"44","0.411147","Routerboardc_64:1a:b5","Broadcast","ARP","60","Who has 209.33.217.69? Tell 209.33.217.65"
"45","0.000000","13.89.223.27","192.168.1.19","TLSv1.2","265","Application Data"
"46","0.000070","192.168.1.19","13.89.223.27","TCP","54","55924  >  443 [ACK] Seq=1 Ack=212 Win=1021 Len=0"
"47","0.086407","192.168.1.19","8.8.4.4","TLSv1.2","421","Application Data"
"48","0.000000","192.168.1.19","8.8.8.8","TLSv1.2","421","Application Data"
"49","0.032690","8.8.4.4","192.168.1.19","TCP","60","443  >  56868 [ACK] Seq=1 Ack=368 Win=290 Len=0"
"50","0.004683","8.8.8.8","192.168.1.19","TCP","60","443  >  56905 [ACK] Seq=1 Ack=368 Win=277 Len=0"
"51","0.006989","8.8.4.4","192.168.1.19","TLSv1.2","1012","Application Data"
"52","0.010979","8.8.8.8","192.168.1.19","TLSv1.2","1013","Application Data"
"53","0.025353","192.168.1.19","142.251.2.84","TCP","66","56940  >  443 [SYN] Seq=0 Win=64240 Len=0 MSS=1460 WS=256 SACK_PERM"
"54","0.012215","192.168.1.19","8.8.4.4","TCP","54","56868  >  443 [ACK] Seq=368 Ack=959 Win=512 Len=0"
"55","0.015461","192.168.1.19","8.8.8.8","TCP","54","56905  >  443 [ACK] Seq=368 Ack=960 Win=255 Len=0"
"56","0.027035","142.251.2.84","192.168.1.19","TCP","66","443  >  56940 [SYN, ACK] Seq=0 Ack=1 Win=65535 Len=0 MSS=1412 SACK_PERM WS=256"
"57","0.000111","192.168.1.19","142.251.2.84","TCP","54","56940  >  443 [ACK] Seq=1 Ack=1 Win=131072 Len=0"
"58","0.000059","192.168.1.19","142.251.2.84","TLSv1.3","571","Client Hello (SNI=accounts.google.com)"
"59","0.060602","142.251.2.84","192.168.1.19","TCP","60","443  >  56940 [ACK] Seq=1 Ack=518 Win=66816 Len=0"
"60","0.000160","142.251.2.84","192.168.1.19","TLSv1.3","2878","Server Hello, Change Cipher Spec"
"61","0.000122","192.168.1.19","142.251.2.84","TCP","54","56940  >  443 [ACK] Seq=518 Ack=2825 Win=131072 Len=0"
"62","0.000145","142.251.2.84","192.168.1.19","TCP","1466","443  >  56940 [ACK] Seq=2825 Ack=518 Win=66816 Len=1412 [TCP segment of a reassembled PDU]"
"63","0.000000","142.251.2.84","192.168.1.19","TLSv1.3","160","Application Data"
"64","0.000065","192.168.1.19","142.251.2.84","TCP","54","56940  >  443 [ACK] Seq=518 Ack=4343 Win=131072 Len=0"
"65","0.024433","192.168.1.19","142.251.2.84","TLSv1.3","134","Change Cipher Spec, Application Data"
"66","0.015797","192.168.1.19","142.251.2.84","TLSv1.3","4061","Application Data"
"67","0.036640","142.251.2.84","192.168.1.19","TCP","60","443  >  56940 [ACK] Seq=4343 Ack=598 Win=66816 Len=0"
"68","0.008368","142.251.2.84","192.168.1.19","TCP","60","443  >  56940 [ACK] Seq=4343 Ack=2010 Win=69632 Len=0"
"69","0.000000","142.251.2.84","192.168.1.19","TCP","60","443  >  56940 [ACK] Seq=4343 Ack=3422 Win=72448 Len=0"
"70","0.000704","142.251.2.84","192.168.1.19","TCP","60","443  >  56940 [ACK] Seq=4343 Ack=4605 Win=75264 Len=0"
"71","0.041841","Routerboardc_64:1a:b5","Broadcast","ARP","60","Who has 209.33.217.78? Tell 209.33.217.65"
"72","0.000000","192.168.1.34","224.0.0.251","MDNS","91","Standard query 0x0000 PTR _raop._tcp.local, ""QM"" question PTR _airplay._tcp.local, ""QM"" question"
"73","0.000000","fe80::c7c:71ae:536b:9e17","ff02::fb","MDNS","111","Standard query 0x0000 PTR _raop._tcp.local, ""QM"" question PTR _airplay._tcp.local, ""QM"" question"
"74","0.000000","Routerboardc_64:1a:b5","Broadcast","ARP","60","Who has 209.33.202.182? Tell 209.33.202.177"
"75","0.000000","192.168.1.1","224.0.0.1","IGMPv3","50","Membership Query, general"
"76","0.045044","142.251.2.84","192.168.1.19","TLSv1.3","1466","Application Data"
"77","0.001085","142.251.2.84","192.168.1.19","TCP","1466","443  >  56940 [PSH, ACK] Seq=5755 Ack=4605 Win=75264 Len=1412 [TCP segment of a reassembled PDU]"
"78","0.000000","142.251.2.84","192.168.1.19","TLSv1.3","391","Application Data, Application Data"
"79","0.000000","142.251.2.84","192.168.1.19","TLSv1.3","177","Application Data"
"80","0.000000","142.251.2.84","192.168.1.19","TLSv1.3","81","Application Data"
"81","0.000064","192.168.1.19","142.251.2.84","TCP","54","56940  >  443 [ACK] Seq=4605 Ack=7654 Win=131072 Len=0"
"82","0.361358","Routerboardc_64:1a:b5","Broadcast","ARP","60","Who has 209.33.217.69? Tell 209.33.217.65"
"83","0.000000","Routerboardc_64:1a:b5","Broadcast","ARP","60","Who has 209.33.202.184? Tell 209.33.202.177"
"84","0.000000","192.168.1.102","224.0.0.251","MDNS","124","Standard query 0x0000 PTR _companion-link._tcp.local, ""QM"" question PTR _rdlink._tcp.local, ""QM"" question PTR _sleep-proxy._udp.local, ""QM"" question"
"85","0.000000","fe80::10ba:ac04:f83d:2539","ff02::fb","MDNS","144","Standard query 0x0000 PTR _companion-link._tcp.local, ""QM"" question PTR _rdlink._tcp.local, ""QM"" question PTR _sleep-proxy._udp.local, ""QM"" question"
"86","0.307043","192.168.1.19","239.255.255.250","SSDP","217","M-SEARCH * HTTP/1.1 "
"87","0.103212","Routerboardc_64:1a:b5","Broadcast","ARP","60","Who has 209.33.202.180? Tell 209.33.202.177"
"88","0.000000","Routerboardc_64:1a:b5","Broadcast","ARP","60","Who has 209.33.202.179? Tell 209.33.202.177"
"89","0.000000","Routerboardc_64:1a:b5","Broadcast","ARP","60","Who has 209.33.217.78? Tell 209.33.217.65"
"90","0.316920","192.168.1.19","224.0.0.22","IGMPv3","54","Membership Report / Join group 224.0.0.251 for any sources"
"91","0.092300","Routerboardc_64:1a:b5","Broadcast","ARP","60","Who has 209.33.202.182? Tell 209.33.202.177"
"92","0.000000","Routerboardc_64:1a:b5","Broadcast","ARP","60","Who has 209.33.202.189? Tell 209.33.202.177"
"93","0.394670","192.168.1.19","224.0.0.22","IGMPv3","54","Membership Report / Join group 224.0.0.252 for any sources"
"94","0.015300","0.0.0.0","255.255.255.255","MNDP","174","5678  >  5678 Len=132"
"95","0.000000","Routerboardc_64:1a:b5","Broadcast","ARP","60","Who has 209.33.202.184? Tell 209.33.202.177"
"96","0.000000","Routerboardc_64:1a:b5","Broadcast","ARP","60","Who has 209.33.202.180? Tell 209.33.202.177"
"97","0.000000","Routerboardc_64:1a:b5","Broadcast","ARP","60","Who has 209.33.202.179? Tell 209.33.202.177"
"98","0.049911","192.168.1.19","142.250.68.42","TLSv1.2","848","Application Data"
"99","0.013759","192.168.1.19","142.250.68.10","TCP","54","56910  >  443 [FIN, ACK] Seq=1 Ack=83 Win=255 Len=0"
"100","0.015867","192.168.1.19","239.255.255.250","SSDP","217","M-SEARCH * HTTP/1.1 "
"101","0.025856","142.250.68.42","192.168.1.19","TCP","60","443  >  56271 [ACK] Seq=1 Ack=795 Win=310 Len=0"
"102","0.013195","Netgear_42:71:eb","Intel_16:56:70","ARP","60","Who has 192.168.1.19? Tell 192.168.1.1"
"103","0.000000","142.250.68.42","192.168.1.19","TLSv1.2","539","Application Data"
"104","0.000027","Intel_16:56:70","Netgear_42:71:eb","ARP","42","192.168.1.19 is at 70:1a:b8:16:56:70"
"105","0.001688","142.250.68.10","192.168.1.19","TCP","60","443  >  56910 [ACK] Seq=83 Ack=2 Win=305 Len=0"
"106","0.021932","192.168.1.19","142.251.40.42","TCP","66","56942  >  443 [SYN] Seq=0 Win=64240 Len=0 MSS=1460 WS=256 SACK_PERM"
"107","0.029838","192.168.1.19","142.250.68.42","TCP","54","56271  >  443 [ACK] Seq=795 Ack=486 Win=509 Len=0"
"108","0.027986","142.251.40.42","192.168.1.19","TCP","66","443  >  56942 [SYN, ACK] Seq=0 Ack=1 Win=65535 Len=0 MSS=1412 SACK_PERM WS=256"
"109","0.000068","192.168.1.19","142.251.40.42","TCP","54","56942  >  443 [ACK] Seq=1 Ack=1 Win=131072 Len=0"
"110","0.003705","192.168.1.19","142.251.40.42","TLSv1.3","571","Client Hello (SNI=signaler-pa.clients6.google.com)"
"111","0.054747","142.251.40.42","192.168.1.19","TCP","60","443  >  56942 [ACK] Seq=1 Ack=518 Win=66816 Len=0"
"112","0.008161","142.251.40.42","192.168.1.19","TLSv1.3","8526","Server Hello, Change Cipher Spec"
"113","0.000072","192.168.1.19","142.251.40.42","TCP","54","56942  >  443 [ACK] Seq=518 Ack=8473 Win=131072 Len=0"
"114","0.000905","142.251.40.42","192.168.1.19","TLSv1.3","1422","Application Data"
"115","0.028396","192.168.1.19","142.251.40.42","TLSv1.3","134","Change Cipher Spec, Application Data"
"116","0.003700","192.168.1.19","142.251.40.42","TLSv1.3","2964","Application Data"
"117","0.061338","142.251.40.42","192.168.1.19","TCP","60","443  >  56942 [ACK] Seq=9841 Ack=598 Win=66816 Len=0"
"118","0.000000","142.251.40.42","192.168.1.19","TCP","60","443  >  56942 [ACK] Seq=9841 Ack=2010 Win=69632 Len=0"
"119","0.000000","142.251.40.42","192.168.1.19","TCP","60","443  >  56942 [ACK] Seq=9841 Ack=3422 Win=72448 Len=0"
"120","0.000000","142.251.40.42","192.168.1.19","TCP","60","443  >  56942 [ACK] Seq=9841 Ack=3508 Win=72448 Len=0"
"121","0.007430","142.250.68.10","192.168.1.19","TLSv1.2","100","Application Data"
"122","0.000000","142.250.68.10","192.168.1.19","TLSv1.2","81","Application Data"
"123","0.000073","192.168.1.19","142.250.68.10","TCP","54","56910  >  443 [RST, ACK] Seq=2 Ack=129 Win=0 Len=0"
"124","0.001205","142.251.40.42","192.168.1.19","TLSv1.3","1235","Application Data, Application Data"
"125","0.000227","142.250.68.10","192.168.1.19","TCP","60","443  >  56910 [FIN, ACK] Seq=156 Ack=2 Win=305 Len=0"
"126","0.048370","Routerboardc_64:1a:b5","Broadcast","ARP","60","Who has 209.33.202.189? Tell 209.33.202.177"
"127","0.005542","192.168.1.19","142.251.40.42","TCP","54","56942  >  443 [ACK] Seq=3508 Ack=11022 Win=131072 Len=0"
"128","0.377383","192.168.1.19","34.236.182.90","TLSv1.2","732","Application Data"
"129","0.018359","Routerboardc_64:1a:b5","Broadcast","ARP","60","Who has 209.33.202.184? Tell 209.33.202.177"
"130","0.000000","Routerboardc_64:1a:b5","Broadcast","ARP","60","Who has 209.33.202.180? Tell 209.33.202.177"
"131","0.071553","34.236.182.90","192.168.1.19","TLSv1.2","443","Application Data"
"132","0.000607","34.236.182.90","192.168.1.19","TLSv1.2","88","Application Data"
"133","0.000121","192.168.1.19","34.236.182.90","TCP","54","56932  >  443 [ACK] Seq=679 Ack=424 Win=253 Len=0"
"134","0.146136","192.168.1.19","142.251.40.35","TLSv1.2","832","Application Data"
"135","0.000088","192.168.1.19","142.250.68.42","TLSv1.2","848","Application Data"
"136","0.014691","192.168.1.19","142.250.68.10","TCP","54","56913  >  443 [FIN, ACK] Seq=1 Ack=83 Win=255 Len=0"
"137","0.031031","192.168.1.19","239.255.255.250","SSDP","217","M-SEARCH * HTTP/1.1 "
"138","0.007721","142.251.40.35","192.168.1.19","TCP","60","443  >  56309 [ACK] Seq=1 Ack=779 Win=417 Len=0"
"139","0.000000","142.250.68.42","192.168.1.19","TCP","60","443  >  56271 [ACK] Seq=486 Ack=1589 Win=310 Len=0"
"140","0.005278","142.251.40.35","192.168.1.19","TLSv1.2","861","Application Data"
"141","0.008689","142.250.68.42","192.168.1.19","TLSv1.2","539","Application Data"
"142","0.005473","142.250.68.10","192.168.1.19","TCP","60","443  >  56913 [ACK] Seq=83 Ack=2 Win=305 Len=0"
"143","0.023715","192.168.1.19","142.251.40.42","TCP","66","56944  >  443 [SYN] Seq=0 Win=64240 Len=0 MSS=1460 WS=256 SACK_PERM"
"144","0.012094","192.168.1.19","142.251.40.35","TCP","54","56309  >  443 [ACK] Seq=779 Ack=808 Win=512 Len=0"
"145","0.000622","192.168.1.19","142.250.68.42","TCP","54","56271  >  443 [ACK] Seq=1589 Ack=971 Win=512 Len=0"
"146","0.040742","142.251.40.42","192.168.1.19","TCP","66","443  >  56944 [SYN, ACK] Seq=0 Ack=1 Win=65535 Len=0 MSS=1412 SACK_PERM WS=256"
"147","0.000229","192.168.1.19","142.251.40.42","TCP","54","56944  >  443 [ACK] Seq=1 Ack=1 Win=131072 Len=0"
"148","0.006355","192.168.1.19","142.251.40.42","TLSv1.3","571","Client Hello (SNI=signaler-pa.clients6.google.com)"
"149","0.042442","Routerboardc_64:1a:b5","Broadcast","ARP","60","Who has 209.33.202.179? Tell 209.33.202.177"
"150","0.000000","Routerboardc_64:1a:b5","Broadcast","ARP","60","Who has 209.33.217.78? Tell 209.33.217.65"
"151","0.000000","Routerboardc_64:1a:b5","Broadcast","ARP","60","Who has 209.33.202.186? Tell 209.33.202.177"
"152","0.007379","142.251.40.42","192.168.1.19","TCP","60","443  >  56944 [ACK] Seq=1 Ack=518 Win=66816 Len=0"
"153","0.003538","142.251.40.42","192.168.1.19","TLSv1.3","4290","Server Hello, Change Cipher Spec"
"154","0.000207","192.168.1.19","142.251.40.42","TCP","54","56944  >  443 [ACK] Seq=518 Ack=4237 Win=131072 Len=0"
"155","0.000221","142.251.40.42","192.168.1.19","TCP","4290","443  >  56944 [PSH, ACK] Seq=4237 Ack=518 Win=66816 Len=4236 [TCP segment of a reassembled PDU]"
"156","0.000000","142.251.40.42","192.168.1.19","TLSv1.3","1422","Application Data"
"157","0.000159","192.168.1.19","142.251.40.42","TCP","54","56944  >  443 [ACK] Seq=518 Ack=9841 Win=131072 Len=0"
"158","0.045555","192.168.1.19","142.251.40.42","TLSv1.3","134","Change Cipher Spec, Application Data"
"159","0.013185","192.168.1.19","142.251.40.42","TLSv1.3","2964","Application Data"
"160","0.039096","142.251.40.42","192.168.1.19","TCP","60","443  >  56944 [ACK] Seq=9841 Ack=598 Win=66816 Len=0"
"161","0.006785","142.251.40.42","192.168.1.19","TCP","60","443  >  56944 [ACK] Seq=9841 Ack=2010 Win=69632 Len=0"
"162","0.000000","142.251.40.42","192.168.1.19","TCP","60","443  >  56944 [ACK] Seq=9841 Ack=3422 Win=72448 Len=0"
"163","0.000000","142.251.40.42","192.168.1.19","TCP","60","443  >  56944 [ACK] Seq=9841 Ack=3508 Win=72448 Len=0"
"164","0.019863","142.250.68.10","192.168.1.19","TLSv1.2","100","Application Data"
"165","0.000000","142.250.68.10","192.168.1.19","TLSv1.2","81","Application Data"
"166","0.000125","192.168.1.19","142.250.68.10","TCP","54","56913  >  443 [RST, ACK] Seq=2 Ack=129 Win=0 Len=0"
"167","0.000409","142.251.40.42","192.168.1.19","TLSv1.3","1235","Application Data, Application Data"
"168","0.000407","142.250.68.10","192.168.1.19","TCP","60","443  >  56913 [FIN, ACK] Seq=156 Ack=2 Win=305 Len=0"
"169","0.040680","192.168.1.19","142.251.40.42","TCP","54","56944  >  443 [ACK] Seq=3508 Ack=11022 Win=130048 Len=0"
"170","0.078850","192.168.1.19","224.0.0.22","IGMPv3","54","Membership Report / Join group 239.255.255.250 for any sources"
"171","0.144777","Routerboardc_64:1a:b5","Broadcast","ARP","60","Who has 209.33.202.189? Tell 209.33.202.177"
"172","0.410282","Routerboardc_64:1a:b5","Broadcast","ARP","60","Who has 209.33.217.78? Tell 209.33.217.65"
"173","0.000000","Routerboardc_64:1a:b5","Broadcast","ARP","60","Who has 209.33.202.186? Tell 209.33.202.177"
"174","0.012788","192.168.1.19","142.251.40.35","TCP","66","56946  >  443 [SYN] Seq=0 Win=64240 Len=0 MSS=1460 WS=256 SACK_PERM"
"175","0.000998","192.168.1.19","142.251.40.35","TLSv1.2","832","Application Data"
"176","0.000269","192.168.1.19","142.251.40.35","TLSv1.2","831","Application Data"
"177","0.000183","192.168.1.19","142.251.40.35","TLSv1.2","832","Application Data"
"178","0.000359","192.168.1.19","142.251.40.35","TLSv1.2","830","Application Data"
"179","0.026439","192.168.1.19","239.255.255.250","SSDP","217","M-SEARCH * HTTP/1.1 "
"180","0.031084","142.251.40.35","192.168.1.19","TCP","60","443  >  56310 [ACK] Seq=1 Ack=779 Win=350 Len=0"
"181","0.003689","142.251.40.35","192.168.1.19","TCP","60","443  >  56309 [ACK] Seq=808 Ack=1556 Win=417 Len=0"
"182","0.000576","142.251.40.35","192.168.1.19","TLSv1.2","861","Application Data"
"183","0.000562","142.251.40.35","192.168.1.19","TCP","66","443  >  56946 [SYN, ACK] Seq=0 Ack=1 Win=65535 Len=0 MSS=1412 SACK_PERM WS=256"
"184","0.000212","192.168.1.19","142.251.40.35","TCP","54","56946  >  443 [ACK] Seq=1 Ack=1 Win=131072 Len=0"
"185","0.000985","142.251.40.35","192.168.1.19","TCP","60","443  >  56055 [ACK] Seq=1 Ack=779 Win=417 Len=0"
"186","0.001320","142.251.40.35","192.168.1.19","TLSv1.2","876","Application Data"
"187","0.000459","142.251.40.35","192.168.1.19","TCP","60","443  >  56056 [ACK] Seq=1 Ack=777 Win=365 Len=0"
"188","0.001145","142.251.40.35","192.168.1.19","TLSv1.2","861","Application Data"
"189","0.001914","142.251.40.35","192.168.1.19","TLSv1.2","876","Application Data"
"190","0.005818","192.168.1.19","142.251.40.35","TLSv1.3","571","Client Hello (SNI=ssl.gstatic.com)"
"191","0.017639","192.168.1.19","142.251.40.35","TLSv1.2","832","Application Data"
"192","0.013739","192.168.1.19","142.251.40.35","TCP","54","56310  >  443 [ACK] Seq=779 Ack=808 Win=512 Len=0"
"193","0.015145","192.168.1.19","142.251.40.35","TCP","54","56309  >  443 [ACK] Seq=1556 Ack=1630 Win=509 Len=0"
"194","0.000021","192.168.1.19","142.251.40.35","TCP","54","56055  >  443 [ACK] Seq=779 Ack=808 Win=509 Len=0"
"195","0.003058","142.251.40.35","192.168.1.19","TCP","60","443  >  56946 [ACK] Seq=1 Ack=518 Win=66816 Len=0"
"196","0.008178","142.251.40.35","192.168.1.19","TLSv1.3","4290","Server Hello, Change Cipher Spec"
"197","0.000000","142.251.40.35","192.168.1.19","TLSv1.3","160","Application Data"
"198","0.000218","192.168.1.19","142.251.40.35","TCP","54","56946  >  443 [ACK] Seq=518 Ack=4343 Win=131072 Len=0"
"199","0.008916","142.251.40.35","192.168.1.19","TCP","60","443  >  56056 [ACK] Seq=823 Ack=1555 Win=372 Len=0"
"200","0.003003","142.251.40.35","192.168.1.19","TLSv1.2","861","Application Data"
"201","0.028591","192.168.1.19","142.251.40.35","TLSv1.3","134","Change Cipher Spec, Application Data"
"202","0.026280","192.168.1.19","142.251.40.35","TCP","54","56056  >  443 [ACK] Seq=1555 Ack=1630 Win=512 Len=0"
"203","0.026270","142.251.40.35","192.168.1.19","TCP","60","443  >  56946 [ACK] Seq=4343 Ack=598 Win=66816 Len=0"
"204","0.987412","Routerboardc_64:1a:b5","Broadcast","ARP","60","Who has 209.33.217.78? Tell 209.33.217.65"
"205","0.000000","Routerboardc_64:1a:b5","Broadcast","ARP","60","Who has 209.33.202.186? Tell 209.33.202.177"
"206","0.408990","Routerboardc_64:1a:b5","Broadcast","ARP","60","Who has 209.33.202.188? Tell 209.33.202.177"
"207","0.357402","192.168.1.19","142.250.68.42","TLSv1.2","846","Application Data"
"208","0.002731","142.251.2.189","192.168.1.19","TLSv1.2","169","Application Data"
"209","0.000000","142.251.2.189","192.168.1.19","TLSv1.2","81","Application Data"
"210","0.000130","192.168.1.19","142.251.2.189","TCP","54","56430  >  443 [ACK] Seq=1 Ack=143 Win=511 Len=0"
"211","0.033545","142.251.2.189","192.168.1.19","TCP","81","[TCP Spurious Retransmission] 443  >  56430 [PSH, ACK] Seq=116 Ack=1 Win=1353 Len=27"
"212","0.000043","192.168.1.19","142.251.2.189","TCP","66","[TCP Dup ACK 210#1] 56430  >  443 [ACK] Seq=1 Ack=143 Win=511 Len=0 SLE=116 SRE=143"
"213","0.010259","192.168.1.19","142.251.2.189","TLSv1.2","1039","Application Data"
"214","0.013336","142.250.68.42","192.168.1.19","TCP","60","443  >  56271 [ACK] Seq=971 Ack=2381 Win=310 Len=0"
"215","0.004461","142.250.68.42","192.168.1.19","TLSv1.2","539","Application Data"
"216","0.031111","192.168.1.19","142.251.40.42","TCP","66","56948  >  443 [SYN] Seq=0 Win=64240 Len=0 MSS=1460 WS=256 SACK_PERM"
"217","0.001194","142.251.2.189","192.168.1.19","TCP","60","443  >  56426 [ACK] Seq=1 Ack=986 Win=530 Len=0"
"218","0.011738","192.168.1.19","142.250.68.42","TCP","54","56271  >  443 [ACK] Seq=2381 Ack=1456 Win=511 Len=0"
"219","0.044577","142.251.40.42","192.168.1.19","TCP","66","443  >  56948 [SYN, ACK] Seq=0 Ack=1 Win=65535 Len=0 MSS=1412 SACK_PERM WS=256"
"220","0.000129","192.168.1.19","142.251.40.42","TCP","54","56948  >  443 [ACK] Seq=1 Ack=1 Win=131072 Len=0"
"221","0.000085","142.251.2.189","192.168.1.19","TLSv1.2","775","Application Data"
"222","0.001411","192.168.1.19","142.251.40.42","TLSv1.3","571","Client Hello (SNI=signaler-pa.clients6.google.com)"
"223","0.007580","142.251.2.189","192.168.1.19","TLSv1.2","105","Application Data"
"224","0.000000","142.251.2.189","192.168.1.19","TLSv1.2","81","Application Data"
"225","0.000075","192.168.1.19","142.251.2.189","TCP","54","56426  >  443 [ACK] Seq=986 Ack=800 Win=512 Len=0"
"226","0.026953","192.168.1.19","142.251.2.189","TLSv1.2","3468","Application Data"
"227","0.005377","199.46.35.122","192.168.1.19","TLSv1.2","78","Application Data"
"228","0.000121","192.168.1.19","199.46.35.122","TCP","54","55901  >  443 [ACK] Seq=1 Ack=25 Win=1023 Len=0"
"229","0.012953","142.251.40.42","192.168.1.19","TCP","60","443  >  56948 [ACK] Seq=1 Ack=518 Win=66816 Len=0"
"230","0.006928","142.251.40.42","192.168.1.19","TLSv1.3","8526","Server Hello, Change Cipher Spec"
"231","0.000000","142.251.40.42","192.168.1.19","TLSv1.3","1421","Application Data"
"232","0.000284","192.168.1.19","142.251.40.42","TCP","54","56948  >  443 [ACK] Seq=518 Ack=9840 Win=131072 Len=0"
"233","0.025629","142.251.2.189","192.168.1.19","TCP","60","443  >  56430 [ACK] Seq=143 Ack=1413 Win=1364 Len=0"
"234","0.000000","142.251.2.189","192.168.1.19","TCP","60","443  >  56430 [ACK] Seq=143 Ack=2825 Win=1375 Len=0"
"235","0.002161","142.251.2.189","192.168.1.19","TCP","60","443  >  56430 [ACK] Seq=143 Ack=3415 Win=1386 Len=0"
"236","0.013643","142.251.40.42","192.168.1.19","TLSv1.2","218","Application Data"
"237","0.010343","192.168.1.19","142.251.40.42","TLSv1.3","134","Change Cipher Spec, Application Data"
"238","0.015538","192.168.1.19","142.251.40.42","TLSv1.3","2668","Application Data"
"239","0.014123","192.168.1.19","142.251.40.42","TCP","54","56937  >  443 [ACK] Seq=1 Ack=165 Win=512 Len=0"
"240","0.023159","142.251.40.42","192.168.1.19","TCP","60","443  >  56948 [ACK] Seq=9840 Ack=598 Win=66816 Len=0"
"241","0.008552","142.251.40.42","192.168.1.19","TCP","60","443  >  56948 [ACK] Seq=9840 Ack=2010 Win=69632 Len=0"
"242","0.000000","142.251.40.42","192.168.1.19","TCP","60","443  >  56948 [ACK] Seq=9840 Ack=3212 Win=72448 Len=0"
"243","0.022350","142.251.40.42","192.168.1.19","TLSv1.3","1355","Application Data, Application Data"
"244","0.000000","142.251.40.42","192.168.1.19","TLSv1.3","99","Application Data"
"245","0.000122","192.168.1.19","142.251.40.42","TCP","54","56948  >  443 [ACK] Seq=3212 Ack=11186 Win=129792 Len=0"
"246","0.002314","142.250.68.10","192.168.1.19","TLSv1.2","81","Application Data"
"247","0.000094","192.168.1.19","142.250.68.10","TCP","54","56934  >  443 [RST, ACK] Seq=2 Ack=28 Win=0 Len=0"
"248","0.001647","142.250.68.10","192.168.1.19","TCP","60","443  >  56934 [FIN, ACK] Seq=28 Ack=2 Win=283 Len=0"
"249","0.087291","142.251.2.189","192.168.1.19","TCP","1466","443  >  56430 [ACK] Seq=143 Ack=3415 Win=1386 Len=1412 [TCP segment of a reassembled PDU]"
"250","0.000000","142.251.2.189","192.168.1.19","TLSv1.2","757","Application Data"
"251","0.000159","192.168.1.19","142.251.2.189","TCP","54","56430  >  443 [ACK] Seq=3415 Ack=2258 Win=512 Len=0"
"252","0.001116","142.251.2.189","192.168.1.19","TLSv1.2","190","Application Data"
"253","0.028299","192.168.1.102","224.0.0.251","MDNS","124","Standard query 0x0000 PTR _companion-link._tcp.local, ""QU"" question PTR _rdlink._tcp.local, ""QU"" question PTR _sleep-proxy._udp.local, ""QU"" question"
"254","0.000000","fe80::10ba:ac04:f83d:2539","ff02::fb","MDNS","144","Standard query 0x0000 PTR _companion-link._tcp.local, ""QU"" question PTR _rdlink._tcp.local, ""QU"" question PTR _sleep-proxy._udp.local, ""QU"" question"
"255","0.000000","Routerboardc_64:1a:b5","Broadcast","ARP","60","Who has 209.33.202.188? Tell 209.33.202.177"
"256","0.000000","Routerboardc_64:1a:b5","Broadcast","ARP","60","Who has 209.33.217.76? Tell 209.33.217.65"
"257","0.013731","192.168.1.19","142.251.2.189","TCP","54","56430  >  443 [ACK] Seq=3415 Ack=2394 Win=512 Len=0"
"258","0.387059","192.168.1.17","224.0.0.251","MDNS","141","Standard query 0x0000 PTR _companion-link._tcp.local, ""QU"" question PTR _rdlink._tcp.local, ""QU"" question PTR lb._dns-sd._udp.local, ""QU"" question PTR _sleep-proxy._udp.local, ""QU"" question"
"259","0.000000","fe80::87c:3fcd:4bd0:4934","ff02::fb","MDNS","161","Standard query 0x0000 PTR _companion-link._tcp.local, ""QU"" question PTR _rdlink._tcp.local, ""QU"" question PTR lb._dns-sd._udp.local, ""QU"" question PTR _sleep-proxy._udp.local, ""QU"" question"
"260","0.205712","142.251.40.42","192.168.1.19","TLSv1.3","136","Application Data"
"261","0.049327","192.168.1.19","142.251.40.42","TCP","54","56948  >  443 [ACK] Seq=3212 Ack=11268 Win=131072 Len=0"
"262","0.155464","192.168.1.102","224.0.0.251","MDNS","124","Standard query 0x0000 PTR _companion-link._tcp.local, ""QM"" question PTR _rdlink._tcp.local, ""QM"" question PTR _sleep-proxy._udp.local, ""QM"" question"
"263","0.408458","Routerboardc_64:1a:b5","Broadcast","ARP","60","Who has 209.33.202.188? Tell 209.33.202.177"
"264","0.000000","Routerboardc_64:1a:b5","Broadcast","ARP","60","Who has 209.33.217.76? Tell 209.33.217.65"
"265","0.409726","192.168.1.17","224.0.0.251","MDNS","81","Standard query 0x0000 PTR lb._dns-sd._udp.local, ""QM"" question"
"266","0.000000","fe80::87c:3fcd:4bd0:4934","ff02::fb","MDNS","101","Standard query 0x0000 PTR lb._dns-sd._udp.local, ""QM"" question"
"267","0.410402","Routerboardc_64:1a:b5","Broadcast","ARP","60","Who has 209.33.202.189? Tell 209.33.202.177"
"268","0.000000","Routerboardc_64:1a:b5","Broadcast","ARP","60","Who has 209.33.202.188? Tell 209.33.202.177"
"269","0.000000","Routerboardc_64:1a:b5","Broadcast","ARP","60","Who has 209.33.217.76? Tell 209.33.217.65"
"270","0.410756","192.168.1.34","224.0.0.251","MDNS","103","Standard query 0x0000 PTR _googlecast._tcp.local, ""QU"" question PTR _CC32E753._sub._googlecast._tcp.local, ""QU"" question"
"271","0.000000","fe80::c7c:71ae:536b:9e17","ff02::fb","MDNS","123","Standard query 0x0000 PTR _googlecast._tcp.local, ""QU"" question PTR _CC32E753._sub._googlecast._tcp.local, ""QU"" question"
"272","0.000000","192.168.1.26","224.0.0.251","MDNS","179","Standard query response 0x0000 PTR 28:ea:2d:d3:26:06@fe80::2aea:2dff:fed3:2606-supportsRP-19._apple-mobdev2._tcp.local PTR 28:ea:2d:d3:26:06@fe80::2aea:2dff:fed3:2606-supportsRP-19._apple-mobdev2._tcp.local"
"273","0.000000","fe80::4fd:7803:28fe:f196","ff02::fb","MDNS","199","Standard query response 0x0000 PTR 28:ea:2d:d3:26:06@fe80::2aea:2dff:fed3:2606-supportsRP-19._apple-mobdev2._tcp.local PTR 28:ea:2d:d3:26:06@fe80::2aea:2dff:fed3:2606-supportsRP-19._apple-mobdev2._tcp.local"
"274","0.000000","144.38.202.78","192.168.1.19","TCP","60","443  >  56258 [ACK] Seq=1 Ack=1 Win=501 Len=0"
"275","0.000448","192.168.1.19","144.38.202.78","TCP","54","[TCP ACKed unseen segment] 56258  >  443 [ACK] Seq=1 Ack=2 Win=509 Len=0"
"276","0.408128","192.168.1.34","224.0.0.251","MDNS","91","Standard query 0x0000 PTR _raop._tcp.local, ""QM"" question PTR _airplay._tcp.local, ""QM"" question"
"277","0.000000","fe80::c7c:71ae:536b:9e17","ff02::fb","MDNS","111","Standard query 0x0000 PTR _raop._tcp.local, ""QM"" question PTR _airplay._tcp.local, ""QM"" question"
"278","0.000000","Routerboardc_64:1a:b5","Broadcast","ARP","60","Who has 209.33.202.189? Tell 209.33.202.177"
"279","0.408222","Routerboardc_64:1a:b5","Broadcast","ARP","60","Who has 209.33.202.188? Tell 209.33.202.177"
"280","0.000000","192.168.1.34","224.0.0.251","MDNS","103","Standard query 0x0000 PTR _googlecast._tcp.local, ""QM"" question PTR _CC32E753._sub._googlecast._tcp.local, ""QM"" question"
"281","0.000000","fe80::c7c:71ae:536b:9e17","ff02::fb","MDNS","123","Standard query 0x0000 PTR _googlecast._tcp.local, ""QM"" question PTR _CC32E753._sub._googlecast._tcp.local, ""QM"" question"
"282","0.409851","Routerboardc_64:1a:b5","Broadcast","ARP","60","Who has 209.33.217.69? Tell 209.33.217.65"
"283","0.000000","Routerboardc_64:1a:b5","Broadcast","ARP","60","Who has 209.33.202.186? Tell 209.33.202.177"
"284","0.820219","Routerboardc_64:1a:b5","Broadcast","ARP","60","Who has 209.33.202.180? Tell 209.33.202.177"
"285","0.000000","Routerboardc_64:1a:b5","Broadcast","ARP","60","Who has 209.33.202.179? Tell 209.33.202.177"
"286","0.000000","192.168.1.17","224.0.0.251","MDNS","81","Standard query 0x0000 PTR lb._dns-sd._udp.local, ""QM"" question"
"287","0.000000","fe80::87c:3fcd:4bd0:4934","ff02::fb","MDNS","101","Standard query 0x0000 PTR lb._dns-sd._udp.local, ""QM"" question"
"288","0.000000","Routerboardc_64:1a:b5","Broadcast","ARP","60","Who has 209.33.217.69? Tell 209.33.217.65"
"289","0.413521","Routerboardc_64:1a:b5","Broadcast","ARP","60","Who has 209.33.202.186? Tell 209.33.202.177"
"290","0.404311","Routerboardc_64:1a:b5","Broadcast","ARP","60","Who has 209.33.202.180? Tell 209.33.202.177"
"291","0.000000","Routerboardc_64:1a:b5","Broadcast","ARP","60","Who has 209.33.202.179? Tell 209.33.202.177"
"292","0.361292","192.168.1.19","35.244.181.201","TCP","54","56898  >  443 [FIN, ACK] Seq=1 Ack=1 Win=512 Len=0"
"293","0.000448","192.168.1.19","34.160.144.191","TCP","54","56900  >  443 [FIN, ACK] Seq=1 Ack=1 Win=512 Len=0"
"294","0.019692","192.168.1.19","8.8.8.8","DNS","70","Standard query 0xc863 A dns.google"
"295","0.000223","192.168.1.19","8.8.8.8","DNS","70","Standard query 0xf9ec HTTPS dns.google"
"296","0.015431","35.244.181.201","192.168.1.19","TCP","60","443  >  56898 [FIN, ACK] Seq=1 Ack=2 Win=265 Len=0"
"297","0.000134","192.168.1.19","35.244.181.201","TCP","54","56898  >  443 [ACK] Seq=2 Ack=2 Win=512 Len=0"
"298","0.005615","34.160.144.191","192.168.1.19","TCP","60","443  >  56900 [FIN, ACK] Seq=1 Ack=2 Win=265 Len=0"
"299","0.000026","192.168.1.19","34.160.144.191","TCP","54","56900  >  443 [ACK] Seq=2 Ack=2 Win=512 Len=0"
"300","0.003988","192.168.1.19","151.101.1.229","TCP","54","56276  >  443 [FIN, ACK] Seq=1 Ack=1 Win=513 Len=0"
"301","0.000026","192.168.1.19","151.101.0.201","TCP","54","56173  >  443 [FIN, ACK] Seq=1 Ack=1 Win=510 Len=0"
"302","0.000051","192.168.1.19","144.38.202.78","TCP","54","56258  >  443 [FIN, ACK] Seq=1 Ack=2 Win=509 Len=0"
"303","0.003212","Routerboardc_64:1a:b5","Broadcast","ARP","60","Who has 209.33.202.184? Tell 209.33.202.177"
"304","0.000000","Routerboardc_64:1a:b5","Broadcast","ARP","60","Who has 209.33.202.189? Tell 209.33.202.177"
"305","0.000000","Routerboardc_64:1a:b5","Broadcast","ARP","60","Who has 209.33.217.69? Tell 209.33.217.65"
"306","0.000000","Routerboardc_64:1a:b5","Broadcast","ARP","60","Who has 209.33.202.186? Tell 209.33.202.177"
"307","0.008326","Routerboardc_64:1a:b5","Broadcast","ARP","60","Who has 209.33.217.73? Tell 209.33.217.65"
"308","0.000000","8.8.8.8","192.168.1.19","DNS","102","Standard query response 0xc863 A dns.google A 8.8.8.8 A 8.8.4.4"
"309","0.000074","8.8.8.8","192.168.1.19","DNS","146","Standard query response 0xf9ec HTTPS dns.google SOA ns1.zdns.google"
"310","0.008607","144.38.202.78","192.168.1.19","TLSv1.2","78","[TCP Previous segment not captured] , Application Data"
"311","0.000000","144.38.202.78","192.168.1.19","TCP","60","443  >  56258 [FIN, ACK] Seq=26 Ack=2 Win=501 Len=0"
"312","0.000052","192.168.1.19","144.38.202.78","TCP","54","56258  >  443 [RST, ACK] Seq=2 Ack=26 Win=0 Len=0"
"313","0.000676","192.168.1.19","8.8.8.8","TCP","66","56951  >  443 [SYN] Seq=0 Win=64240 Len=0 MSS=1460 WS=256 SACK_PERM"
"314","0.007309","192.168.1.19","8.8.8.8","TCP","66","56952  >  443 [SYN] Seq=0 Win=64240 Len=0 MSS=1460 WS=256 SACK_PERM"
"315","0.005214","151.101.1.229","192.168.1.19","TCP","60","443  >  56276 [ACK] Seq=1 Ack=2 Win=290 Len=0"
"316","0.002412","151.101.0.201","192.168.1.19","TCP","60","443  >  56173 [ACK] Seq=1 Ack=2 Win=290 Len=0"
"317","0.000872","151.101.0.201","192.168.1.19","TLSv1.2","85","Encrypted Alert"
"318","0.000018","192.168.1.19","151.101.0.201","TCP","54","56173  >  443 [RST, ACK] Seq=2 Ack=32 Win=0 Len=0"
"319","0.001783","151.101.0.201","192.168.1.19","TCP","60","443  >  56173 [FIN, ACK] Seq=32 Ack=2 Win=290 Len=0"
"320","0.000000","151.101.1.229","192.168.1.19","TLSv1.2","78","Application Data"
"321","0.000026","192.168.1.19","151.101.1.229","TCP","54","56276  >  443 [RST, ACK] Seq=2 Ack=25 Win=0 Len=0"
"322","0.001429","151.101.1.229","192.168.1.19","TCP","60","443  >  56276 [FIN, ACK] Seq=25 Ack=2 Win=290 Len=0"
"323","0.018298","8.8.8.8","192.168.1.19","TCP","66","443  >  56951 [SYN, ACK] Seq=0 Ack=1 Win=65535 Len=0 MSS=1412 SACK_PERM WS=256"
"324","0.000172","192.168.1.19","8.8.8.8","TCP","54","56951  >  443 [ACK] Seq=1 Ack=1 Win=131072 Len=0"
"325","0.000076","192.168.1.19","8.8.8.8","TLSv1.3","571","Client Hello (SNI=dns.google)"
"326","0.008466","8.8.8.8","192.168.1.19","TCP","66","443  >  56952 [SYN, ACK] Seq=0 Ack=1 Win=65535 Len=0 MSS=1412 SACK_PERM WS=256"
"327","0.000093","192.168.1.19","8.8.8.8","TCP","54","56952  >  443 [ACK] Seq=1 Ack=1 Win=131072 Len=0"
"328","0.000195","192.168.1.19","8.8.8.8","TLSv1.3","571","Client Hello (SNI=dns.google)"
"329","0.019052","8.8.8.8","192.168.1.19","TCP","60","443  >  56951 [ACK] Seq=1 Ack=518 Win=66816 Len=0"
"330","0.013518","8.8.8.8","192.168.1.19","TLSv1.3","1466","Server Hello, Change Cipher Spec"
"331","0.000924","8.8.8.8","192.168.1.19","TCP","2878","443  >  56951 [PSH, ACK] Seq=1413 Ack=518 Win=66816 Len=2824 [TCP segment of a reassembled PDU]"
"332","0.000000","8.8.8.8","192.168.1.19","TLSv1.3","274","Application Data"
"333","0.000080","192.168.1.19","8.8.8.8","TCP","54","56951  >  443 [ACK] Seq=518 Ack=4457 Win=131072 Len=0"
"334","0.006051","8.8.8.8","192.168.1.19","TCP","60","443  >  56952 [ACK] Seq=1 Ack=518 Win=66816 Len=0"
"335","0.013894","8.8.8.8","192.168.1.19","TLSv1.3","4290","Server Hello, Change Cipher Spec"
"336","0.000000","8.8.8.8","192.168.1.19","TLSv1.3","274","Application Data"
"337","0.000084","192.168.1.19","8.8.8.8","TCP","54","56952  >  443 [ACK] Seq=518 Ack=4457 Win=131072 Len=0"
"338","0.001204","192.168.1.19","8.8.8.8","TLSv1.3","134","Change Cipher Spec, Application Data"
"339","0.027743","192.168.1.19","8.8.8.8","TLSv1.3","134","Change Cipher Spec, Application Data"
"340","0.003940","8.8.8.8","192.168.1.19","TCP","60","443  >  56951 [ACK] Seq=4457 Ack=598 Win=66816 Len=0"
"341","0.000073","192.168.1.19","8.8.8.8","TLSv1.3","421","Application Data"
"342","0.024424","8.8.8.8","192.168.1.19","TCP","60","443  >  56951 [ACK] Seq=4457 Ack=965 Win=67840 Len=0"
"343","0.006410","8.8.8.8","192.168.1.19","TCP","60","443  >  56952 [ACK] Seq=4457 Ack=598 Win=66816 Len=0"
"344","0.000025","192.168.1.19","8.8.8.8","TLSv1.3","421","Application Data"
"345","0.006578","8.8.8.8","192.168.1.19","TLSv1.3","1466","Application Data"
"346","0.000000","8.8.8.8","192.168.1.19","TLSv1.3","199","Application Data"
"347","0.000128","192.168.1.19","8.8.8.8","TCP","54","56951  >  443 [ACK] Seq=965 Ack=6014 Win=131072 Len=0"
"348","0.020477","8.8.8.8","192.168.1.19","TCP","60","443  >  56952 [ACK] Seq=4457 Ack=965 Win=67840 Len=0"
"349","0.010473","8.8.8.8","192.168.1.19","TLSv1.3","1466","Application Data"
"350","0.000000","8.8.8.8","192.168.1.19","TLSv1.3","198","Application Data"
"351","0.000080","192.168.1.19","8.8.8.8","TCP","54","56952  >  443 [ACK] Seq=965 Ack=6013 Win=131072 Len=0"
"352","0.021328","192.168.1.19","52.70.208.247","TCP","66","56954  >  443 [SYN] Seq=0 Win=64240 Len=0 MSS=1460 WS=256 SACK_PERM"
